{
  "schema_version": "1",
  "bundle_id": "eel-wave-3-baseline-example",
  "created_at": "2026-01-01T00:00:00Z",
  "tally_root": "0000000000000000000000000000000000000000000000000000000000000001",
  "artefacts": [
    {
      "name": "eel-register-svc",
      "kind": "image",
      "sha256": "0000000000000000000000000000000000000000000000000000000000000001",
      "source_ref": "0000000000000000000000000000000000000001",
      "build_recipe": "packages.x86_64-linux.eel-register-svc",
      "sbom_ref": "sboms/eel-register-svc.sbom.json",
      "cosign_sig_ref": "sboms/eel-register-svc.sig"
    },
    {
      "name": "eel-ballot-svc",
      "kind": "image",
      "sha256": "0000000000000000000000000000000000000000000000000000000000000002",
      "source_ref": "0000000000000000000000000000000000000002",
      "build_recipe": "packages.x86_64-linux.eel-ballot-svc",
      "sbom_ref": "sboms/eel-ballot-svc.sbom.json",
      "cosign_sig_ref": "sboms/eel-ballot-svc.sig"
    },
    {
      "name": "eel-tally-svc",
      "kind": "image",
      "sha256": "0000000000000000000000000000000000000000000000000000000000000003",
      "source_ref": "0000000000000000000000000000000000000003",
      "build_recipe": "packages.x86_64-linux.eel-tally-svc",
      "sbom_ref": "sboms/eel-tally-svc.sbom.json",
      "cosign_sig_ref": "sboms/eel-tally-svc.sig"
    },
    {
      "name": "eel-results-svc",
      "kind": "image",
      "sha256": "0000000000000000000000000000000000000000000000000000000000000004",
      "source_ref": "0000000000000000000000000000000000000004",
      "build_recipe": "packages.x86_64-linux.eel-results-svc",
      "sbom_ref": "sboms/eel-results-svc.sbom.json",
      "cosign_sig_ref": "sboms/eel-results-svc.sig"
    },
    {
      "name": "eel-audit-svc",
      "kind": "image",
      "sha256": "0000000000000000000000000000000000000000000000000000000000000005",
      "source_ref": "0000000000000000000000000000000000000005",
      "build_recipe": "packages.x86_64-linux.eel-audit-svc",
      "sbom_ref": "sboms/eel-audit-svc.sbom.json",
      "cosign_sig_ref": "sboms/eel-audit-svc.sig"
    }
  ]
}
